sheng-sheng-zui-ru-lan , 刚刚看了高中生对于哥德巴赫猜想的证明，真是一言难尽……祝大家新年快乐吧!首先，从逻辑学上讲[条件恒假，命题恒真]。其次，在-1是负质数的前提下，证明-1不是负质数的操作简直文体两开花。最后，2n+1真的不一定是质数唉:-(总之，再有想法也要多读读书，别章口就莱。你连让我证伪的机会都不给简直过分。(高中生删原文了，但是证明过程已被记录括弧笑，链接如下{url:https%3A//http://www.urlshare.cn/umirror_url_check?_wv=1&amp;srctype=touch&amp;apptype=android&amp;loginuin=861327921&amp;plateform=mobileqq&amp;url=https%253A%252F%252Fzhuanlan.zhihu.com%252Fp%252F53752944)&amp;src_uin=861327921&amp;src_scene=311&amp;cli_scene=getDetail,text:网页链接}
ao-qia-mu-73 , 2019了 不用冲业绩了 放过这颗瓜吧 知乎 
ao-qia-mu-73 , 2019了 不用冲业绩了 放过这颗瓜吧 知乎 
ci-mu-94-7 , 简而言之，一切问题要在定义域内讨论。哥德巴赫猜想的定义域不包括负质数，你搞个负质数出来，那不管你证明了还是没有证明，你搞的这个东西都不叫哥德巴赫猜想。不能拿前朝的剑斩本朝的官，还美名其曰有借有还。
xie-mai-25 , 如图
gao-san-gou-67-76 , 这是我扒皮他的文章肖明浩BIT：他是民科还是天才，这是一个问题很明显的弱智行为，但是他为啥要这样做呢？我来大胆的猜测一下:
 , 证明方面的错误已经说得很明白了，逻辑方面有问题。最大的错误是：想用哗众取宠的方式来获取关注。这种方式在有的平台可以，在有的领域可以，但是在知乎这种脑残粉相对少的平台有点难，在数学这样的领域有点难。如果他在微博弄个玄学命题，说不定现在就不会这么尴尬了。
yong-rao-59 , 怎么说呢，视频中最后一句话挺好的。                                                            https://www.zhihu.com/video/1063228886854340608                                      
xiao-kan-hong-chen-93-64 , 这位同学连民科的水平都不如，民科证明这些都是花里胡哨的各种转换，各种变形，其中还夹杂着一些高大上的数学名词和自己发明的原理，不仔细看个半天还真的不好找出来哪里有错误。这位同学以为自己区区几步就能证明出来困扰了人们上百年的问题，不知道是侮辱别人的智商还是自己的智商有问题。
hou-jia-hong-7 , 非邀自来。说点儿题外话。记得我高中时不时的也幻想自己能搞出大定理搞一个大事情，年少轻狂，我也有的。回答这么多，其实很多答主想表达的是那份对学术的敬畏心:可以希望借学术成绩有所贡献甚至名流青史，但是不能胡来。成绩背后无人不是付出无法轻易与人说的努力。如果我挺幸运，那个高中生能看到我的回答，希望他不要因为这个事情放弃科学之心，要明白的是或许我们所理解的科学背后是我们不曾了解的许多东西，我们都在学习和成长。可能我们终生也无法证明猜想，但或许我们有机会有能力为了证明它而做出一些推动，这很多时候已经很不错了
xing-er-shang-xue-de-ge-zhe , 解:欲证哥德巴赫猜想成立∵举一个哥德巴赫猜想不成立的例子又∵举不出来∴哥德巴赫猜想成立好了我证明出来了谢谢大家
 , 第一页就满篇错误，负质数是什么？怎么定义的，有什么性质？你自己定义了一个东西啥都不说直接用了？？你的变式一想说明什么？2n=-1+2n-1不是恒成立的吗？有什么意义？？建议多读书，多做题，没了。
 , 过于狂傲，油盐不进。可还记得祢衡之死？木强则折。——————哦。我还想说。这位兄弟 你该练字了…
psychbruce , “证明”了一大堆，其实两行字就能解决：∵ 所有命题都是真命题∴ 哥德巴赫猜想正确借用易中天老师在“开讲啦”里面怼某个杠精的一句名言：“你一大堆逻辑不通哦  我告诉你”
yong-rao-59 , 怎么说呢，视频中最后一句话挺好的。                                                            https://www.zhihu.com/video/1063228886854340608                                      
xiao-kan-hong-chen-93-64 , 这位同学连民科的水平都不如，民科证明这些都是花里胡哨的各种转换，各种变形，其中还夹杂着一些高大上的数学名词和自己发明的原理，不仔细看个半天还真的不好找出来哪里有错误。这位同学以为自己区区几步就能证明出来困扰了人们上百年的问题，不知道是侮辱别人的智商还是自己的智商有问题。
qian-yu-6-44 , 质数不是负数  哥猜不是瞎猜！ 
xiao-san-xiao-57-53 , 觉得这个高中生很厉害了，毕竟我上高中那会儿都不知道有哥德巴赫猜想。
chen-chao-50-26-85 , 四个字：循环论证
infatuate-27 , 错误的地方很多大佬都已经指出就没什么好说的了。我从其他方面回答一下。第一，证明过程所用知识过于简陋，基本上用到的知识限于高一的知识，就是自己定义了一个概念，配合逆否命题等。如果对比陈景润的证明过程就会发现别人已经把能用上的方法都用上了才止步与“1+2”。而且我作为一个数学杂碎都看的懂就没什么可能证明出来的了。第二，证明过于短小，陈景润的证明有一本书一样厚，费马大定理的证明有109张图片的数量，你这撑死就两面，还没有高考一道大题的答案长你证明个鬼哦！第三，建议各位取关，事情已经过去了，可以终止这场闹剧了。数学是一座孤岛，凡事想直接乾坤大挪移过去的，基本上都葬身鱼腹了，老老实实的读书吧。
 , 我证明黎曼猜想的论文即将于大年初一公布，请各位知友稍待。
psychbruce , “证明”了一大堆，其实两行字就能解决：∵ 所有命题都是真命题∴ 哥德巴赫猜想正确借用易中天老师在“开讲啦”里面怼某个杠精的一句名言：“你一大堆逻辑不通哦  我告诉你”
dian-ji-she-zhi-59 , 看到你们回答，我默默从陈景润的棺材板上下来了
dong-bai-yue-69 , 感觉问题主要出现在逆否命题:若存在正整数n_0，使得2n_0∉A，则-1不是负质数。这个逆否命题是证不出来的。A:任一正偶数都可写成两个质数之和。A等价于:哥德巴赫猜想成立且-1是负质数。这个逆否命题也就是:若(哥德巴赫猜想成立且-1是负质数)不成立，则-1不是负质数。这是怎么证明的？？？ 假设哥德巴赫猜想成立吗(ﾟoﾟ( •̥́ ˍ •̀ )
 , 这种民科思想的证明，是要向各位知友谢罪的
xie-mai-25 , 如图
xin-xiang-yuan-lai , 这个世界很复杂，有时候要简单一点，其实每个人生活都在一念之间，一念对的，就走向光明，一念错了，就走向黑暗，对与错一念，一个念头会让你糊涂，一个念头会让你清醒。人不管有多快乐、多烦恼，都是在自己的念头当中。一念间，一念天堂，一念地狱。
bo-ling-yi-jian-shuang-han-shi-si-zhou , 果然是逻辑鬼才 精神领袖 划时代玄学家杂交水稻出来背锅。
bai-ri-meng-15-67 , 谁还没有中二过。
 , 虽然我不清楚他在证些什么，但没用  是怎么得到  的不过收获还是有的，我又多了一种方法证明  ！
 , 看不懂的不是你的问题，是这个人的问题。全篇用到的知识几乎只要高一就能看懂。但是导致很多人看不懂的原因就是这个人的逻辑太过混乱。不知道是刻意而为之还是怎么，证明过程几乎前言不搭后语。明明该按着顺序的两句文字叙述非要倒过来。且先不说负质数因为该存在命题是真命题，所以该逆否命题是真命题，-1不是负质数。又因为逆否命题与原命题等价，原命题是真命题，所以若-1是负质数时，哥德巴赫猜想变式一成立。嗯，那真的牛批。
bai-ri-meng-15-67 , 谁还没有中二过。
 , 单看原命题的话，2n=48时，2n=-1+2n+1，2n+1=49，也就是48等于负质数-1加合数49，得出反例证明者原意应当是将-1加入质数集后，2n属于A。
jing-la-ke , 其实一个人活在自己梦幻的世界里不见得是件坏事，毕竟自己喜欢得不得了，至少过得下去。
chen-rui-wu-19-9 , 膨胀了，这种题目我也敢点进来。
sheng-sheng-zui-ru-lan , 刚刚看了高中生对于哥德巴赫猜想的证明，真是一言难尽……祝大家新年快乐吧!首先，从逻辑学上讲[条件恒假，命题恒真]。其次，在-1是负质数的前提下，证明-1不是负质数的操作简直文体两开花。最后，2n+1真的不一定是质数唉:-(总之，再有想法也要多读读书，别章口就莱。你连让我证伪的机会都不给简直过分。(高中生删原文了，但是证明过程已被记录括弧笑，链接如下{url:https%3A//http://www.urlshare.cn/umirror_url_check?_wv=1&amp;srctype=touch&amp;apptype=android&amp;loginuin=861327921&amp;plateform=mobileqq&amp;url=https%253A%252F%252Fzhuanlan.zhihu.com%252Fp%252F53752944)&amp;src_uin=861327921&amp;src_scene=311&amp;cli_scene=getDetail,text:网页链接}
 , 我证明黎曼猜想的论文即将于大年初一公布，请各位知友稍待。
xu-shao-feng-44 , 原谅 支持 鼓励 看到这么多评论的态度竟然如此一致如此无脑，被当猴耍过了还要安慰自己一下，阿Q精神真是够够的。真心佩服他们团队，戏做的真足演的真像。不说了，退乎保智商。
hu-xing-27-27 , 我觉得应该鼓励，看他的证明不要仅仅指出他犯了那些错误，也要表扬他那些是正确的东西。这个年龄的高中生能够对这个感兴趣的已经很不容易了
 , 虽然我不清楚他在证些什么，但没用  是怎么得到  的不过收获还是有的，我又多了一种方法证明  ！
zsgs2008 , 居然都说他证明错了！！？人家证明的是“歌猜”啊
wo-de-xin-zai-er-ci-yuan , 命题:若“我的姐姐”是“男的”，则所有““人”的妈妈”是“女的”逆风命题:若存在某个“人”，这个“人的妈妈”不是“女的”，则“我的姐姐”不是“男的”举例:存在“人”是“我”时，若“我的妈妈”不是“女的”，则“我的姐姐”不是“男的”得证，证毕。
dong-bai-yue-69 , 感觉问题主要出现在逆否命题:若存在正整数n_0，使得2n_0∉A，则-1不是负质数。这个逆否命题是证不出来的。A:任一正偶数都可写成两个质数之和。A等价于:哥德巴赫猜想成立且-1是负质数。这个逆否命题也就是:若(哥德巴赫猜想成立且-1是负质数)不成立，则-1不是负质数。这是怎么证明的？？？ 假设哥德巴赫猜想成立吗(ﾟoﾟ( •̥́ ˍ •̀ )
huang-qiu-ji-70 , 虽然没看懂，但字好稚嫩。。而且这纸张量会不会太少了
yong-cai-27-75 , 我还想大学报数学来着一个同级的证明我都看不懂我还是去搬砖吧
olina-16 , 呃呃呃呃。表示我只是进来想看看高中生是长什么样子的，对于数学界的皇冠七窍通六巧...
lin-zao-23 , 借题发挥一下，大家与其无意义地浪费时间在这个连初中生都能看懂的高中生的无意义的小学生错误证明，不如来看看我的意义重大的角谷猜想(3n+1猜想）的连顶尖数学家都看不懂的天才证明，看看我是否正确，欢迎大家提出批评意见，不过丑话说在前头，如果连普林斯顿顶尖数学家都看不懂，那你们大家就更别想看懂了
hulianwangzhaopin , 也不知道是一个有知识还是没知识的人在一个充满知识的地方把一群好像还挺有知识的人耍的就好像没有了知识。知识不是年少轻狂，不是插科打诨，更不是哗众取宠。知识应该是工匠的，应该是求实的，应该是严谨的。最后一句，警惕知乎变某博！
zhao-da-pao-7-20 , 我觉得他成功了，没有任何错误
gan-run-dong , 完全是循环论证，自创定义。我一句话归纳他的证明。质数加质数等于偶数，命题得证。还是多关注这个问题吧https://www.zhihu.com/question/306987629
 , 为方便各位理解数学大佬们的指错内容，故把原文悉数奉上，因为这位高中生已经把自己的证明文章删了。
logo-94-94 , 我觉得他之所以选哥德巴赫猜想而不是黎曼猜想的原因是因为他看不懂黎曼猜想错误在哪？全篇都是好吧，光逻辑都有一堆问题，更别提数学方面的东西了，当然他最大的错误是对自己的水平没有正确的判断，以为就自己是人类的未来和希望，以前努力研究了几百年的数学家都是垃圾
wang-long-18-43 , 首先他用分治的思想把偶数分割成6k+2, 6k和6k-2三个部分, 这个思路很好。但是每一个分证明都有逻辑上的错误。拿6k+2部分举例：本质上他的“变一”是“哥猜正确"和“2n=(-1)+(2n+1)”这两个子命题的逻辑或。其中2n=(-1)+(2n+1)是个恒等式，不管2n+1是不是质数，这恒等式都成立；不管哥猜正确不正确，这恒等式也都成立。既然这个恒等式永远成立，那么变一也肯定是真命题，哪怕有一天别人证明了哥猜是错的，变一仍然是真命题。之后，他的思路是：6k+3不是质数，所以2n=(-1)+(2n+1)部分可以舍去，这是错的。2n=(-1)+(2n+1)是个恒等式，2n+1是不是质数它都成立，没办法舍去。如果真能舍去的话，那变一就不一定是真命题了，因为变一是真命题的根本原因就在这个恒等式上面。
kthread , 这个问题是不成立的，连人家证明的是什么东西都搞错了！你们自己看清楚，人家证的明明是歌德的巴赫猜想！不要总想搞big news就把人家judge一番！不懂就要虚心请教！人家专门发了文章给你们答疑，要好好抓住机会learn something，提高自己的knowledge啊！
die-hua-feng-21 , 有史以来，最大规模的改卷子就是今天吧。
cao-xiao-jian-82-19 , 本来那群数学家的棺材板质量就不太好，令人震惊的是歌德和巴赫也要诈尸了！
long-ya-57-84 , 用纸笔写的，符号不规范，证明过程不规范，结论错误，这些都不是问题。主要问题是字太丑了。
jin-yu-peng-89-64 , 真的是，我刚发完镜像提问，结果就看到你这儿已经一堆答案了。写欢乐颂的歌德和写马太受难曲的巴赫强烈质疑棺材板的质量。按照他的说法，他弄了个跳出质数定义的-1，相当于从无限虚空中召唤了个唯物世界上不存在的工具，用完还扔了回去，这孩子（比我大两岁）小学都功底不扎实，说到功底我就想起了美猴王苦练七十二变时打实功底的不易，今年下半年（真巧2019了），中美合拍的西游记即将正式开机，我继续扮演美猴王孙悟空，我会用美猴王艺术形象努力创造一个正能量的形象，文体两开花，弘扬中华文化，希望大家能多多关注。
liu-mang-tu-tu-84-55 , 希望不是搞营销的，如果是高中生对于数学的爱好的话也是值得鼓励的！
 , 其实身为一名高中生尽管他的目的性太强但是我觉得他的实力和敢于证明哥猜的勇气绝对是超过大部分高中生的起码比起我要厉害点——来自一位咸鱼高二学生
zui-chou-xiao-tian-cai-matezhu-hai , 加油！相信有一天他可以的
yang-xi-17-4 , 这位高中生显然不懂什么叫“数学证明”。他的所谓“证明”不是真正的数学证明，所以也谈不上对错。之前他的老师还说，他的证明大框架是对的，只是在一些真正能说明问题的细节上写的模糊。这个评价。。。如果这位老师真的看过此证明，可见现在的中学数学老师多么缺乏数学素养。如果真如他老师所言，那这学生很不错了，毕竟一个高中生搞懂了除去最难部分的内容，也是不易的。大学本科数学首先教学生“什么是真正的数学证明”以及“如何正确的思考一个数学问题”，其次才教如何证明，以及相关知识。没有受过专业训练的人就像这个高中生一样，以为自己在思考，以为自己在证明，实际不是。现在的学生啊真浮躁，没几个踏实的。我高中时也是很喜欢数学，很愿意探索现代数学的，但我跟这同学不同，我是一步一步走，他想一步登天。他根本不了解，提出一个全新角度的解法，发明一个新的数学工具，到底有多难。什么叫一步一步走？我那时先是提前看完了高二高三数学书，然后做各地高考试卷，模拟卷，尤其做那种高考大省的，出题难的，比如河南，江苏这些。练了一段时间练到什么程度呢？水平已经超过高三学生，基础题看一眼就知道思路答案。后来只看选择题，填空题，大题的最后一题，因为只有这些才有可能难到我了。再后来，连压轴题都无法满足我了，我才想着去看看大学课本。说的意思不是说必须高考考145+才能去学现代数学，而是应该先把高考搞定再去做更喜欢更有兴趣的东西。
yu-men-huo-men-fei-men , 刚才有伙计跟我说,又有人在知乎黑民科了.卧槽这能忍?简直不把我民科小王子放在眼里,马上注册小号去怼这些逼乎er.民科咋了,吃你家米了?你们体制科学家拿着我们纳税人发的工资,整天就知道灌水发paper,又有多少人有成果?在逼乎追星杨超越,沉迷游戏都是政治正确,怎么就容不下一个民科.高中生民科证哥德巴赫猜想是搞笑,体制科学家就不搞笑了？菲尔兹奖得主Michael_Atiyah爵士证黎曼猜想就不搞笑了--("甚至不能算是个错误!")--.来啊,互相伤害啊.这个证明哥德巴赫猜想的高中生,威哥不认识你.但威哥看了你的证明,虽然没有成果,但你对哥德巴赫猜想的认识至少超过99%(估)知乎er.如今学术资源几近垄断,民科在今天只能自娱,但自娱就已经足够,认识世界进一存有进一寸的欢喜.最后补充一句,评判一个人的行为,只要他在大众均值以上,都应该鼓励与支持.飞翔吧,高中生!
wang-peng-81-22 , 首先，大家的纠错和嘲讽，都是这高中少年该受的，自己做的选择，自己要承担后果。但是，这孩子，没违法犯罪吧？没侵犯其他人利益吧？而某些人，用极其狭隘的心胸，对该少年的行为上纲上线的进行批斗，什么对学术的侮辱都来了，恨不能把这孩子踩到泥土里永世不得翻身，恨不得让这孩子给所有网友磕头谢罪，甚至觉得网络暴力有理了，甚至觉得这孩子因为网络暴力自闭、抑郁、甚至自杀都是活该，我觉得有点过分了。贴两个典型吧。一个高中的孩子装了波逼。。。。。直接就上升到科学工作者的形象问题和科学工作亵渎问题了。。。。我真的是。。。。科学工作的门槛什么时候这么低了？不拿诺奖不改名，这个id倒是充分体现了此人无比的清高与自傲，此人此时的心态，恐怕是觉得自己所从事的事业是无比的清高与伟大的，一个高中小屁孩，思考这些问题就是对自己的侮辱。说来也巧，今天刚好看了黑子的篮球last game，此人的想法倒是与纳什.戈尔多.jr的想法非常的相似呢：你们这些日本猴子也配打篮球？你们打篮球就是对我的侮辱。你一个高中生也配思考哥猜？你提这两个字就是对我的侮辱。真心可怕。再贴另外一个声援不拿诺奖不改名的人士不仅认为这孩子侮辱了数学工作者，而且把知乎的乱象归结于这个孩子身上，甚至认为这孩子错在把证明发到网上了，我觉得此人侮辱了“言论自由”四个字，侮辱了“我不同意你说的每一个字，但我愿誓死捍卫你说话的权利”这句话。当然，这个高中生可能是营销号，那是另外一个问题了。这两个人，都把我拉黑了，辩论不过就拉黑，将心胸的狭隘体现的淋漓尽致。拉黑真是个好工具，可以直接向对方表示：“不听不听王八念经，反正我是对的你是错的你不用说了”。可惜我也不是什么心胸宽广的人呢，你们喜欢拉黑，我就给你们晒晒太阳。不过是一个有点过分中二的无知少年而已，不过就是装了个逼装大了然后装破了而已，年轻气盛，谁没装过逼呢？谁没自命不凡过呢？谁上学的时候没有过质疑权威的想法呢？如果无知都算侮辱的话，那全世界至少40亿人无时不刻的都在侮辱学术，甚至于嘲讽这个孩子的人中，有相当一部分也是学术水平不足的（比如揪着“负质数”本身不放的），那是不是同样也是在装逼呢，同样也是侮辱了学术呢？大家纠错也纠错了，嘲讽也嘲讽了，这孩子也认识到了自己的无知和浅薄，删文退场了，也算是个知错能改的少年，跟那些死犟不服的民科还是有本质区别的，他自己恐怕也认识到了几千网友的口水是多么恐怖，以后也不会轻易在公众平台发表看法了，人非圣贤孰能无过，得饶人处且饶人，别为了自己的口舌之快毁了一个孩子的一生。
pei-yan-lin-93 , 这个回答告诉我们：这世界，从来不缺少指出错误的人唯独缺少面对未知勇于给出自己答案的人经过一众网友的这番嘲弄，怕是世间又少了一个后者犯错不可怕，实际上99%的变革者都是失败者，而成功者99%的想法也是错误的，哪怕开国伟人也在犯错。但正是1%的成功者的1%的正确的答案，推动了这个世界的发展。我们都读过高中，我们都知道哥德巴赫猜想，但我们其中有多少人认真思考并试图证明它，又有多少人得到证明结果后哪怕知道它99%是错的还去勇敢地公开它。究竟多少人，有给出自己答案的勇气？这个少年没有证明出来哥德巴赫猜想一点不丢人，以他高中生的修为犯一些数学上的低级错误也不丢人。但他给出他的答案的勇气值得肯定，他承认自己错误的态度值得肯定。假如全中国每个高中生本科生乃至研究生，都思考一下这个问题，然后给出自己的“错误”，这无数的创意和经验可能会给那些站在金字塔顶端的数学家提供很多灵感，搞不好一个恍惚间就有人证出来了。我们需要99%的错误啊，这无疑是有利于数学的进步的。固然，少年在这件事的处理上还显得很浮躁、狂妄和自大，像极了我们每个人的少年时。志不轻狂妄少年，对这些我们应该一笑而过，继续鼓励少年们的“轻狂”，而不是嘲弄或打击。我希望少年在经历这次错误后，还会纠正错误继续思考，不断完善自己的解法。而不是畏惧犯错，从此止步不前，知道哥德巴赫可是数学王冠上的明珠啊，我一个高中生肯定解不出来，我再也不在这上浪费时间了。知乎是个理性的社区，希望大家不要纠结于一个高中生的小挫败，你要想证明自己的强大不妨公开你的解法，或者给那些试图给出解法的人一些鼓励。
xiao-de-ai , 哥氏猜想的证明是不能引入负素数的！如果认为素数的相反数也是素数，那么哥氏猜想就可以写成任意足够大的偶数都可以表示为2个素数的和或差。然而任意偶数都可以表示为2个素数的差是已被证明的（存疑）。这实际上是广义孪生素数猜想的极弱化版。
mei-yitian-huan-le , 数学上他不一定是天才，营销上他绝对是天才。他开创了一种新的营销模式，学术营销。35k的粉丝意味着什么，这不用多说了。我辛辛苦苦回答了一年的问题，连他零头都没有。不少三四年的大v都没有这个数量。可以想象，不久的将来，网络上会有无数人争相模仿他。
15072418862 , 像是一个营销行为，很厉害啊
tai-yang-8-10 , 他不是天才，只是个孩子。但是在所有人都嘲笑他的时候却没人想到曾经的自己似乎也有过这样一段不知天高地厚的阶段。那时的我们刚刚知道这个世界可以用数字和逻辑来表达，似乎脑海里那些十万个为什么都能用精确的小数点来解释，那是一种少年奇遇屠龙术的狂喜。后来随着你的长大，你开始慢慢承认自己的渺小，那个屠龙少年也被你选择性的忘记。当有个孩子重复这些事情时，你忙着用参透一切的口吻告诉那个孩子这样有多傻多蠢。但你忘了你也曾是想要屠龙的少年！
zeng-qi-ge-ge , 我是刘增祺我想说哥德巴赫猜想不需要证明你去证明费马大定理多好育明的大佬都不用混了24的巨佬都可以玩了开篇就是数列什么的我告诉你这个东西研究生也不配去碰别误入歧途像我一样
 , 这位营销小天才背后是有出谋划策的，我觉得甚至是在知乎支持下的，知乎贾君鹏
he-min-xin-90 , 定义质数又称素数。一个大于1的自然数，除了1和它自身外，不能整除其他自然数的数叫做质数；否则称为合数。2019猪位看客开心yu快地迎来了！耍猴啥时候结束 @证明 
